{
  "id": "charity-local-international",
  "title": "Charity: Local vs International Aid",
  "category": "Society & Ethics",
  "difficulty": "Medium",
  "question": {
    "text": "Some people think that charity organizations should only help people in their own country. However, others believe these organizations should aid people in great need wherever they live. Discuss both views and give your own opinion.",
    "type": "Discuss Both Views",
    "wordCountTarget": 270
  },
  "steps": [
    {
      "stepNumber": 1,
      "title": "Topic Analysis",
      "type": "analysis",
      "unlockCondition": "Always unlocked",
      "completionCriteria": "View all content",
      "content": {
        "questionType": {
          "type": "Discuss Both Views",
          "explanation": "You must discuss BOTH perspectives equally (local charity AND international aid) and clearly state your own opinion.",
          "requirements": [
            "Discuss reasons for prioritizing local charity",
            "Discuss reasons for supporting international aid",
            "Give your clear personal opinion",
            "Provide specific examples for each view"
          ]
        },
        "keyWords": [
          {
            "word": "charity organizations",
            "definition": "Non-profit groups that provide help to those in need",
            "importance": "This is the main subject - who should they help?"
          },
          {
            "word": "own country",
            "definition": "The nation where the charity is based",
            "importance": "This defines one perspective - focus locally"
          },
          {
            "word": "great need",
            "definition": "Severe suffering or urgent requirements",
            "importance": "Emphasizes humanitarian priority regardless of location"
          },
          {
            "word": "wherever they live",
            "definition": "Any location globally",
            "importance": "This defines the international perspective"
          },
          {
            "word": "both views",
            "definition": "Two different perspectives on charity allocation",
            "importance": "Signals you MUST discuss both sides equally"
          },
          {
            "word": "your opinion",
            "definition": "Your personal viewpoint",
            "importance": "You must take a clear position - don't be too neutral"
          }
        ],
        "essayStructure": {
          "introduction": "2-3 sentences: Paraphrase question + state your opinion",
          "body1": "4-5 sentences: Discuss first view (local charity focus)",
          "body2": "4-5 sentences: Discuss second view (international aid)",
          "conclusion": "2 sentences: Summarize both views + restate opinion"
        },
        "commonMistakes": [
          "Only discussing one side in detail",
          "Opinion is unclear or too balanced ('both are important')",
          "Forgetting to give concrete examples of charity work",
          "Copying words directly from the question"
        ]
      }
    },
    {
      "stepNumber": 2,
      "title": "Vocabulary Builder",
      "type": "vocabulary",
      "unlockCondition": "Complete Step 1",
      "completionCriteria": "View all vocabulary",
      "content": {
        "academicVocabulary": [
          {
            "word": "allocation",
            "pronunciation": "/ˌæləˈkeɪʃən/",
            "partOfSpeech": "noun",
            "definition": "The distribution of resources for a specific purpose.",
            "example": "The allocation of charitable funds requires careful consideration of priorities.",
            "synonyms": [
              "distribution",
              "assignment"
            ]
          },
          {
            "word": "humanitarian",
            "pronunciation": "/hjuːˌmænɪˈteəriən/",
            "partOfSpeech": "adjective",
            "definition": "Concerned with promoting human welfare.",
            "example": "Humanitarian aid organizations respond to crises regardless of borders.",
            "synonyms": [
              "philanthropic",
              "compassionate"
            ]
          },
          {
            "word": "prioritize",
            "pronunciation": "/praɪˈɒrɪtaɪz/",
            "partOfSpeech": "verb",
            "definition": "To treat something as more important than others.",
            "example": "Many donors prioritize helping communities they can directly observe.",
            "synonyms": [
              "emphasize",
              "focus on"
            ]
          },
          {
            "word": "accountability",
            "pronunciation": "/əˌkaʊntəˈbɪləti/",
            "partOfSpeech": "noun",
            "definition": "The obligation to explain and justify actions.",
            "example": "Domestic charities offer greater accountability to local taxpayers.",
            "synonyms": [
              "responsibility",
              "transparency"
            ]
          },
          {
            "word": "obligation",
            "pronunciation": "/ˌɒblɪˈɡeɪʃən/",
            "partOfSpeech": "noun",
            "definition": "A duty or commitment to take action.",
            "example": "Some argue we have a moral obligation to help the most vulnerable globally.",
            "synonyms": [
              "duty",
              "responsibility"
            ]
          },
          {
            "word": "equitable",
            "pronunciation": "/ˈekwɪtəbəl/",
            "partOfSpeech": "adjective",
            "definition": "Fair and impartial.",
            "example": "An equitable approach considers need rather than nationality.",
            "synonyms": [
              "fair",
              "just",
              "impartial"
            ]
          },
          {
            "word": "proximity",
            "pronunciation": "/prɒkˈsɪməti/",
            "partOfSpeech": "noun",
            "definition": "Nearness in space or relationship.",
            "example": "Geographic proximity creates stronger emotional connections to local causes.",
            "synonyms": [
              "closeness",
              "nearness"
            ]
          },
          {
            "word": "substantial",
            "pronunciation": "/səbˈstænʃəl/",
            "partOfSpeech": "adjective",
            "definition": "Of considerable importance or size.",
            "example": "International crises often require substantial emergency resources.",
            "synonyms": [
              "significant",
              "considerable"
            ]
          }
        ],
        "topicVocabulary": [
          {
            "phrase": "domestic poverty",
            "definition": "Financial hardship within one's own country.",
            "example": "Domestic poverty remains a serious issue in many developed nations."
          },
          {
            "phrase": "global inequality",
            "definition": "Disparities in wealth and resources between countries.",
            "example": "Global inequality means some nations face far greater humanitarian needs."
          },
          {
            "phrase": "donor fatigue",
            "definition": "Reduced willingness to give due to overwhelming requests.",
            "example": "Charities worry that donor fatigue limits their fundraising capacity."
          },
          {
            "phrase": "humanitarian crisis",
            "definition": "Emergency situation threatening human welfare.",
            "example": "Humanitarian crises like earthquakes require immediate international response."
          },
          {
            "phrase": "civic responsibility",
            "definition": "The duty citizens have to their community.",
            "example": "Supporting local charities reflects civic responsibility and community bonds."
          },
          {
            "phrase": "resource distribution",
            "definition": "How charitable funds and aid are allocated.",
            "example": "Effective resource distribution ensures aid reaches those most in need."
          }
        ],
        "linkingPhrases": {
          "introducing": [
            "There is considerable debate about",
            "People hold differing views regarding",
            "While some contend"
          ],
          "contrasting": [
            "On the one hand",
            "On the other hand",
            "Conversely",
            "However"
          ],
          "adding": [
            "Furthermore",
            "Moreover",
            "Additionally",
            "In addition"
          ],
          "exemplifying": [
            "For instance",
            "For example",
            "Such as",
            "Particularly"
          ],
          "concluding": [
            "In conclusion",
            "To summarize",
            "Overall",
            "Ultimately"
          ]
        }
      }
    },
    {
      "stepNumber": 3,
      "title": "Sentence Builder",
      "type": "exercises",
      "unlockCondition": "Complete Step 2",
      "completionCriteria": "Complete 35/48 exercises correctly",
      "content": {
        "instructions": "Build sentences you can use in your essay. Complete templates by choosing the right words. These sentences are organized by function - save the ones you complete correctly to use in Step 6!",
        "exerciseSections": [
          {
            "function": "thesis-statements",
            "title": "Thesis Statements (Introduction)",
            "description": "Complete sentences that state both views and your opinion",
            "exercises": [
              {
                "id": "thesis1",
                "type": "template",
                "template": "While some believe _____, others argue that _____.",
                "blanks": [
                  {
                    "id": "thesis1_b1",
                    "options": [
                      "charities should prioritize domestic needs",